{
  "schema_version": "reason-ir/0.1",
  "initial_state": {
    "state_id": "WeatherQuery",
    "state_type": "tool_request",
    "data": {
      "city": "Tokyo"
    }
  },
  "goal": {
    "kind": "produce_answer",
    "target": "WeatherAnswer"
  },
  "context_refs": [
    {
      "context_id": "weather-tool",
      "context_type": "tool",
      "uri": "tool://weather.lookup"
    }
  ],
  "transitions": [
    {
      "transition_id": "invoke-weather-tool",
      "source": "WeatherQuery",
      "relation": "InvokeTool",
      "target": "WeatherAnswer",
      "expected_cost": 2,
      "effect": {
        "tool_ref": "weather.lookup"
      }
    }
  ],
  "execution_policy": {
    "max_steps": 8,
    "rollback_on_failure": true,
    "constraint_mode": "reject"
  },
  "trace_policy": {
    "level": "detailed",
    "include_alternatives": true,
    "include_state_data": true
  },
  "metadata": {
    "producer": "typescript-sdk/0.1"
  }
}
